{
  "session_id": "full-flow-board-log-rework-closure",
  "producer_agent": "knowledge-planner",
  "repo_scope": ["src/example/fusion/timestamp_alignment.cpp", "src/example/fusion/ego_motion_compensation.cpp"],
  "verification_plan": ["run local timestamp alignment regression", "run local ego-motion compensation regression", "rerun board validation with prompt-provided high yaw-rate trace"]
}
